{
  "schemaVersion": "1.0",
  "reportId": "2026-05-14-repair-loop-dogfood-3-validation-report",
  "workflowId": "top-skill-2-repair-loop-dogfood",
  "judicialPassId": "judicial",
  "judicialHandoffRef": "handoffs/judicial.handoff.json",
  "repairAttemptIds": [
    "repair-1"
  ],
  "executionEvidence": {
    "executionIsolationLevel": "runner-enforced",
    "verificationEvidenceLevel": "hard-check-verified",
    "runnerName": "top-protocol-runner",
    "separateInvocationIds": [
      "resp_06604cee168fa603006a066fa776088197b5c293e55cd8840d",
      "resp_0f9314b634209b9a006a066fade92081a1b973c84655bfe940",
      "resp_0459cc0d20fec108006a066fb596388193b9e7f9e1a925b5de",
      "resp_02fc014bb8dc1f7d006a066fc5b7848192a53088beea55285b"
    ],
    "schemaValidationCommand": "python scripts/top_protocol_runner.py <runner-workflow.json>",
    "hardCheckCommands": [
      "python -B scripts/quick_validate.py ."
    ],
    "limitations": [
      "Scaffolded runner workflow.",
      "LLM API adapter is configured; runner-enforced evidence requires successful API credentials and separate model invocations."
    ]
  },
  "artifactScope": "orchestration run package 2026-05-14-repair-loop-dogfood-3",
  "checkedFiles": [
    "runner/runner-workflow.json",
    "runner/runner-report.json",
    "handoffs/judicial.handoff.json",
    "invocations/executive.invocation-evidence.json",
    "invocations/judicial-initial.invocation-evidence.json",
    "invocations/repair-1.invocation-evidence.json",
    "invocations/judicial.invocation-evidence.json"
  ],
  "commandsRun": [
    "python -B scripts/certify_orchestration_run.py --root <run-package>"
  ],
  "requiredHardChecks": [
    {
      "id": "top-skill-quick-validate",
      "description": "Run top-skill package validation.",
      "requiredForComplete": true,
      "status": "pass",
      "command": "python -B scripts/quick_validate.py .",
      "evidence": [
        "quick_validate: OK\nvalidated: D:\\TOP\\top-skill\nhard_checks: 21\nagent_review_candidates: 0"
      ]
    }
  ],
  "violationClassesChecked": [
    "runner-enforced-isolation",
    "hard-check-evidence",
    "independent-judicial-handoff",
    "required-pass-status",
    "self-certification",
    "post-repair-judicial-validation"
  ],
  "gateResults": [
    {
      "gateId": "runner-evidence",
      "violationClass": "runner-evidence",
      "status": "pass",
      "evidence": [
        "runnerStatus=pass",
        "executionIsolationLevel=runner-enforced",
        "verificationEvidenceLevel=hard-check-verified"
      ]
    },
    {
      "gateId": "required-pass-status",
      "violationClass": "runner-pass",
      "status": "pass",
      "evidence": [
        "executive:pass",
        "judicial-initial:pass",
        "repair-1:pass",
        "judicial:pass"
      ]
    },
    {
      "gateId": "adapter-invocation-evidence",
      "violationClass": "runner-invocation",
      "status": "pass",
      "evidence": [
        "executive:fresh=True,contextPackageOnly=True,modelEvidence=True",
        "judicial-initial:fresh=True,contextPackageOnly=True,modelEvidence=True",
        "repair-1:fresh=True,contextPackageOnly=True,modelEvidence=True",
        "judicial:fresh=True,contextPackageOnly=True,modelEvidence=True"
      ]
    },
    {
      "gateId": "separate-invocation-and-context-ids",
      "violationClass": "runner-invocation",
      "status": "pass",
      "evidence": [
        "invocationIds=4",
        "contextIds=4"
      ]
    },
    {
      "gateId": "required-hard-checks",
      "violationClass": "hard-check",
      "status": "pass",
      "evidence": [
        "top-skill-quick-validate:pass"
      ]
    },
    {
      "gateId": "independent-judicial-handoff",
      "violationClass": "judicial-validation",
      "status": "pass",
      "evidence": [
        "judicialPassId=judicial",
        "judicial handoff is independent from executive/repair authority"
      ]
    },
    {
      "gateId": "post-repair-judicial-validation",
      "violationClass": "repair-loop",
      "status": "pass",
      "evidence": [
        "judicialPassId=judicial",
        "postRepairPassIds=repair-1"
      ]
    },
    {
      "gateId": "self-certification",
      "violationClass": "separation-of-powers",
      "status": "pass",
      "evidence": [
        "No executive or repair handoff certified delivery."
      ]
    }
  ],
  "blockingViolations": [],
  "unverifiedAreas": [],
  "finalValidationStatus": "pass",
  "independence": {
    "currentFilesRead": true,
    "executorClaimsIgnored": true,
    "samePassAsGenerationOrRepair": false,
    "selfCertificationDetected": false
  }
}
