{
  "schemaVersion": "1.0",
  "reportId": "2026-05-14-driver-exit-status-dogfood-validation-report",
  "workflowId": "top-skill-2-driver-dogfood",
  "judicialPassId": "judicial",
  "judicialHandoffRef": "handoffs/judicial.handoff.json",
  "executionEvidence": {
    "executionIsolationLevel": "schema-validated",
    "verificationEvidenceLevel": "hard-check-verified",
    "runnerName": "top-protocol-runner",
    "separateInvocationIds": [
      "2026-05-14-driver-exit-status-dogfood-executive-invocation",
      "2026-05-14-driver-exit-status-dogfood-judicial-invocation"
    ],
    "schemaValidationCommand": "python scripts/top_protocol_runner.py <runner-workflow.json>",
    "hardCheckCommands": [
      "python -B scripts/quick_validate.py ."
    ],
    "limitations": [
      "Dogfood runner workflow for driver exit/status semantics.",
      "Passes are separate processes, not separate model invocations.",
      "No external runner-enforced invocation evidence is present.",
      "Runner isolation was not accepted as runner-enforced evidence."
    ]
  },
  "artifactScope": "orchestration run package 2026-05-14-driver-exit-status-dogfood",
  "checkedFiles": [
    "runner/runner-workflow.json",
    "runner/runner-report.json",
    "handoffs/judicial.handoff.json",
    "invocations/executive.invocation-evidence.json",
    "invocations/judicial.invocation-evidence.json"
  ],
  "commandsRun": [
    "python -B scripts/certify_orchestration_run.py --root <run-package>"
  ],
  "requiredHardChecks": [
    {
      "id": "top-skill-quick-validate",
      "description": "Run top-skill package validation.",
      "requiredForComplete": true,
      "status": "pass",
      "command": "python -B scripts/quick_validate.py .",
      "evidence": [
        "quick_validate: OK\nvalidated: D:\\TOP\\top-skill\nhard_checks: 20\nagent_review_candidates: 0"
      ]
    }
  ],
  "violationClassesChecked": [
    "runner-enforced-isolation",
    "hard-check-evidence",
    "independent-judicial-handoff",
    "required-pass-status",
    "self-certification"
  ],
  "gateResults": [
    {
      "gateId": "runner-evidence",
      "violationClass": "runner-evidence",
      "status": "fail",
      "evidence": [
        "runnerStatus=pass",
        "executionIsolationLevel=schema-validated",
        "verificationEvidenceLevel=hard-check-verified"
      ]
    },
    {
      "gateId": "required-pass-status",
      "violationClass": "runner-pass",
      "status": "pass",
      "evidence": [
        "executive:pass",
        "judicial:pass"
      ]
    },
    {
      "gateId": "adapter-invocation-evidence",
      "violationClass": "runner-invocation",
      "status": "fail",
      "evidence": [
        "executive:fresh=True,contextPackageOnly=False,modelEvidence=False",
        "judicial:fresh=True,contextPackageOnly=False,modelEvidence=False"
      ]
    },
    {
      "gateId": "separate-invocation-and-context-ids",
      "violationClass": "runner-invocation",
      "status": "pass",
      "evidence": [
        "invocationIds=2",
        "contextIds=2"
      ]
    },
    {
      "gateId": "required-hard-checks",
      "violationClass": "hard-check",
      "status": "pass",
      "evidence": [
        "top-skill-quick-validate:pass"
      ]
    },
    {
      "gateId": "independent-judicial-handoff",
      "violationClass": "judicial-validation",
      "status": "pass",
      "evidence": [
        "judicialPassId=judicial",
        "judicial handoff is independent from executive/repair authority"
      ]
    },
    {
      "gateId": "self-certification",
      "violationClass": "separation-of-powers",
      "status": "pass",
      "evidence": [
        "No executive or repair handoff certified delivery."
      ]
    }
  ],
  "blockingViolations": [
    "runner-evidence: runnerStatus=pass, executionIsolationLevel=schema-validated, verificationEvidenceLevel=hard-check-verified",
    "adapter-invocation-evidence: executive:fresh=True,contextPackageOnly=False,modelEvidence=False, judicial:fresh=True,contextPackageOnly=False,modelEvidence=False"
  ],
  "unverifiedAreas": [
    "Delivery law gates did not all pass."
  ],
  "finalValidationStatus": "fail",
  "independence": {
    "currentFilesRead": true,
    "executorClaimsIgnored": true,
    "samePassAsGenerationOrRepair": false,
    "selfCertificationDetected": false
  }
}
